{
  "process_type": "tax",
  "request_id": "REQ-2026-0003",
  "idempotency_key": "grunderwerbsteueranzeige-2026-03",
  "actor_context": {
    "actor_role": "notariatsfachkraft",
    "actor_display": "Notariat Vollzug",
    "requested_decision_type": "requires_review",
    "impact_level": "high",
    "compliance_impact": true,
    "requested_qualification": [
      "notarial_office_training"
    ],
    "qualification_evidence": [
      "CERT-NOTARIAT-OPS-001"
    ],
    "approver_role": "notar_fachlich"
  },
  "status": "prepared",
  "year": 2026,
  "tax_type": "grunderwerbsteueranzeige",
  "period": "2026-03",
  "source_refs": [
    "REQ-2026-0001",
    "REQ-2026-0002"
  ],
  "requires_review": true,
  "totals": {
    "net_amount": 1200.0,
    "tax_amount": 228.0,
    "gross_amount": 1428.0
  },
  "metadata": {
    "owner": "notariat-vollzug"
  }
}
